24003,B&B Het Zummerheem,"Amazing breakfast, very clean rooms, and nice staff.",,8
24100,B&B Het Zummerheem,"The breakfast was very nice, full of varieties of food to eat to full you up throughout the day  it was amazing",The jacuzzi was not on,10
24153,B&B Het Zummerheem,The location was very nice and peaceful perfect,Going home,10
24136,B&B Het Zummerheem,"Beautiful setting, quite and rural.  Safe parking.  Lovely owners.  Breakfast was great.  Would use again.",,7.5
24118,B&B Het Zummerheem,It was simple and functional. Everything you needed with really friendly staff and a good breakfast. I would use again.,"A bit unromantic so I wouldn't stop there with my wife and son on a trip, but for single person use its fine.",8.8
24258,B&B Het Zummerheem,"Nice place to stay, quiet, comfortable room.  A great breakfast, kind hosts - we had a nice chat.",,9.2
23977,B&B Het Zummerheem,excellent breakfast quiet place and very pleasant environment room very clean staff very available,,9
