8820,Beijing Hotel Minsk,Beijing Hotel located in a park area. Everywhere is green.,"Beijing Hotel is very nice. BUT house keeping is not good. First day; you receive very nice room. SECOND day and next days ; they don't clean room, don't take garbage, don't clean dust, don't put soap.. i asked 3 times to clean room. They don't clean.",2.9
8475,Beijing Hotel Minsk,"This is a complete package for those who on a business or a romantic trip. It's quiet, the staff 5star level trading to the T. Very helpful and always nice. 
Rooms are spacious and has everything you would expect to have in a hotel room of a 5star hotel. ",,10
8854,Beijing Hotel Minsk,,1. The room and bath were not clean  2 hotel charging with American dollars and obligat to pay with rubals according to Hotel rate which is 5% more,6.7
8676,Beijing Hotel Minsk,Really great breakfast! Very clean hotel!,,9.2
8810,Beijing Hotel Minsk,The building and the restaurant are nice.,Noisy room. Not clear air conditioning. Some mosquitos inside the room. Awful cocktails at the bar.,5.4
8545,Beijing Hotel Minsk,,The shrimps in the restaurant were with guts.,9
8606,Beijing Hotel Minsk,Excellent breakfast and stable Wi-Fi.,Strange lighting switches scheme. Only parks near the residence no shops or restaurants in walking distance.,8.8
