21900,Hotel Adoma,So expensive. Small room (not the same as the pictures). Good location next to the main station.,,4.2
21590,Hotel Adoma,Perfect location for the station and Art Gallery. A very regular tram to take you into the centre of the  city.  A beautiful train station too !!,,9
21600,Hotel Adoma,"The personnel is really good and friendly! They are ready to help in any situation.
The room was quite big. The noise from railway was practically not heard. In case you need to stay somewhere close to city center for a reasonable price - it's a very good option!",The noise from telephone in hall in the morning.,7.5
21734,Hotel Adoma,Close to the old town. Free parking,Breakfast was a bit simple.,7.1
21581,Hotel Adoma,We were happy to be able to take a walk along the river into Ghent.,,9
21626,Hotel Adoma,"Breakfast was good, the hotel has a really good quiet location. The staff were very nice and helpful to us! The room was clean, the beds were comfortable.","Parking can be a little bit of an issue especially if you have a big car. But there are other very cheap parking options close by, the staff was very helpful about this.",8
21631,Hotel Adoma,Very nice staff at reception. Comfortable and well-furnished room. What is always important is a clean and spacious bathroom.,"Typical Belgian breakfast. It could be a bit more varied. Besides, I have no remarks.",7.9
