21023,Vakantielogies Cathedral,Clean. Near the festival. Friendly and helpful staff,The steps were too thin and dangerous,7.5
21006,Vakantielogies Cathedral,"Friendly staff, nice rooms. Quite nice for a one night stay.",,8
21101,Vakantielogies Cathedral,Good location,"It was very hot in the room
",7.5
21222,Vakantielogies Cathedral,"Very close to historic city center, comfortable, clean
",,8.3
21178,Vakantielogies Cathedral,An was a fantastic host and gave us tips inc a walking tour of Ghent which we enjoyed greatly.  The beds are comfortable and the room is modern.  Location is ideal for walking into the town centre.  Highly recommended,,10
21008,Vakantielogies Cathedral,New hotel. It's clean and close to the centre.,,9
21189,Vakantielogies Cathedral,Location is ok,DON'T GO TO HOTEL CATHEDRAL! Both the bathroom and room are really dirty! Please see the picture of our 'clean' bathroom. I've never seen something like this. For this price you could get a proper hotel instead of a really dirty room.,2.5
