569,Alfa Inn,"I love the staff they are really accomodating, friendly and warm welcoming. The breakfast is excellent ! The room is clean, expect I can hear some noise outside but it's totally fine. The location is perfect for shopping and groceries and perfect for summer !
Handsdown to their lounge, i find it so peaceful and romantic !! ","During the night there is a strange sound like it's like a drops of water through out the night, seems like that. Also the sink in the bathroom doesn't drain well :)",10
664,Alfa Inn,The breakfast is excellent. Owner and staffs are very friendly It is definitely worth to come back again,,9.2
493,Alfa Inn,"The place is cozzy and confy. The service is amazing, all of them are extra nice. The room was perfect for us.",The pillows could be better.,9
501,Alfa Inn,"The staff was wonderful: very friendly, supportive without being overimposing. The room was great, spacious, well equipped, clean. The excellent breakfast was delivered to our room due to COVID, which was great; perfectly on time, fresh coffee, copious..",,9
633,Alfa Inn,"Friendly staff and amazing breakfast buffet. The best location. Close to shops, the beach and easy transportation",maybe provide iron & iron board,9.6
463,Alfa Inn,"Sunday, my wife and I checked in in the Alfa inn hotel in Blankenberge. Is already our second stay there. Rooms weren't ready because we were early, immediately we got an upgrade to another very beautiful room. Wow!! What a room. Amazing. The lady at the front desk was very helpful and kind. The next surprise is the breakfast basket. I am a big eater, but we had to struggle to enjoy it all. Thank you, you have 3 stars, but this place surely deserves 5 stars. We will be back!!!!
To the staff of the Alfa inn hotel. Two thumbs up 
So if you ever wanna stay at Blankenberge. One place to go overnight. The Alfa inn hotel ♥️",All was fine and great,10
622,Alfa Inn,Everything was better than expected enough said,Fridge didn't work,10
