13471,B&B Sogni d'oro,It was a very pleasant stay as our hosts were very attentive to our comfort. We had a comfortable room although bathroom and toilet are shared. Small but thoughtful tokens such as candies in a basket for guests were much appreciated. The neighbourhood is pleasant and there is ample parking at the residence.,,10
13370,B&B Sogni d'oro,"super quant, super clean, close enough to the city to enjoy, far enough to have peace and quiet",/,9
13386,B&B Sogni d'oro,"Friendly host, very clean bedroom and breakfast area, comfortable bed, private bathroom and continental  breakfast. Parking space on the premise.","Being both 1m80 tall, the bathroom was very uncomfortable for us. We had to walk bended over towards the toilet and could hardly sit upright on it. There was only a bath, no shower (again you could not stand upright but had to sit ) It is a real challenge not to bang your head due to the declining ceiling.",8
13437,B&B Sogni d'oro,"The breakfast was first class. I have Coeliac disease which proved no problem to my hosts who went out of their way to get me gluten free bread. The room was very clean, furnished well with a lovely comfortable bed. I was very much made to feel at home and I will certainly return on my next visit.",,10
13486,B&B Sogni d'oro,Amita and her husband were so welcoming. Her advice on where to visit and other information in the local area and amenities was invaluable. The accommodation was excellent. We would definitely stay again and recommend the b&b ⭐⭐⭐⭐,,10
13454,B&B Sogni d'oro,"Very comfortable and cosy, nice room and breakfast, gentle host, it's a nice place to stay, very quiet too",nothing special,9.6
13403,B&B Sogni d'oro,Anita was a great host who was able to give us guidance about  getting around the area. The room was clean and pleasant  with a comfortable bed.  Parking at the house was an added bonus. Driving into Ghent from here was not a problem.,The bedroom is on the second floor with a shared shower and sink on that level. The toilet is on the first floor --down several steps. We were fine with this arrangement but if one has difficulty with stairs it may be a challenge.,8.3
