18362,Hotel Koffieboontje,The area is okay.,"Room was small, no airco and way too expensive for the quality. Even though we booked for 3 persons their was only 2 sets of towels. ",4.6
17576,Hotel Koffieboontje,The bed was super comfortable and the hotel was in a fab location!!,The walls were paper thin so was noisy from the room next to me but nothing too bad,8.3
18456,Hotel Koffieboontje,"The reception was super nice
It's right in the city center and we had great views",,10
19074,Hotel Koffieboontje,position,no idea where to park Although kettle supplied no wall sockets worked. no charging of phones laptop was possible appeared to be mid update.  The bed was comfortable to sleep but as only one chair bed was too soft to sit on. we had to stay 2 nights as we had app with a vet for dog,4.6
17765,Hotel Koffieboontje,Nice clean place easy location and reasonable rates. Great for family on a budget or couple on 2-3 days stop over,I luv the hotel but the booking.com website is not very clear so I advise people look on site then contact hotel direct.,8.3
18736,Hotel Koffieboontje,Friendly welcome and room size. Perfect location.,,9.6
17971,Hotel Koffieboontje,Proximity to all important sites,"Rundown and poorly maintained room
",5
